{
  "schema_version": "2",
  "tool": {
    "name": "credscope",
    "version": "corpustest"
  },
  "scan": {
    "repository": "integrated-allowlist-ignore-config",
    "started_at": "2026-01-01T00:00:00Z",
    "completed_at": "2026-01-01T00:00:00Z",
    "duration_ms": 0,
    "format": "json",
    "fail_on": "none",
    "minimum_score": 0,
    "threshold_exceeded": false,
    "configuration": {
      "include": [
        ".github/workflows/*.yaml",
        ".github/workflows/*.yml",
        "compose.yaml",
        "compose.yml",
        "docker-compose.yaml",
        "docker-compose.yml"
      ],
      "exclude": [
        ".git/**",
        ".tmp/**",
        "build/**",
        "coverage/**",
        "dist/**",
        "node_modules/**",
        "vendor/**"
      ],
      "disabled_rules": [],
      "no_color": false,
      "quiet": false,
      "verbose": false
    },
    "profile": {
      "requested": "production",
      "selected": "production",
      "source": "explicit",
      "reason": "Selected explicitly by command-line option or repository configuration.",
      "assumptions": [
        "Published services, broad credential sharing, and privileged runtime settings receive stricter risk weighting.",
        "Internet exposure is not assumed without direct evidence."
      ]
    }
  },
  "policies": {
    "scoring_policy": "v2",
    "rule_catalog": "v2"
  },
  "summary": {
    "credential_count": 1,
    "informational": 0,
    "low": 1,
    "medium": 0,
    "high": 0,
    "critical": 0,
    "highest_score": 35,
    "threshold_exceeded": false
  },
  "credentials": [
    {
      "credential": {
        "id": "node:credential:820c73ebb5d7e74de6f10340eed8a410e9e7783fb94a542129faa53cf1ebbb09",
        "label": "ACTIVE_PROD_TOKEN",
        "type": "generic-api-key",
        "fingerprints": [
          "sha256:039f4c35feaf9e76d2a8bf468ada5f1305f53a16ea82f197d32c03112e2bee32"
        ],
        "classification": "secret",
        "classification_confidence": "confirmed",
        "classification_reason": "An imported secret-scanner finding independently indicates secret-like content.",
        "classification_source": "imported_scanner_finding",
        "expected_secret": true,
        "rotation_remediation_applicable": true,
        "test_fixture_candidate": false
      },
      "score": 35,
      "severity": "low",
      "policy_version": "v2",
      "rule_catalog_version": "v2",
      "matched_rules": [
        {
          "rule_id": "CRD101",
          "title": "Credential finding imported",
          "category": "credential_exposure",
          "severity": "informational",
          "confidence": "confirmed",
          "evidence": [
            {
              "rule_id": "generic-api-key",
              "type": "scanner_finding",
              "description": "Active production credential, not covered by any allowlist entry",
              "location": {
                "path": ".env.example",
                "line": 2
              },
              "field": "finding",
              "source": "gitleaks",
              "confidence": "confirmed"
            }
          ],
          "affected_node_ids": [
            "node:finding:1f8ff3c162a02f98219d086c3d7ea8070f5751cc769177277a09d54c27f7e871"
          ],
          "path_ids": [
            "path:252a9cf2698413f660c0f7a20ceb53cbb8be6eae61f5c4a5c65ffadf8ba100e9"
          ],
          "remediation_id": "REM001"
        },
        {
          "rule_id": "CRD102",
          "title": "Credential referenced by workflow",
          "category": "github_actions",
          "severity": "low",
          "confidence": "confirmed",
          "evidence": [
            {
              "rule_id": "",
              "description": "GitHub Actions workflow",
              "location": {
                "path": ".github/workflows/deploy.yml",
                "line": 1,
                "column": 1
              },
              "source": "github-actions",
              "confidence": "confirmed"
            },
            {
              "rule_id": "",
              "type": "signal:secret_copied_to_environment",
              "description": "A secret reference is copied into workflow-level environment scope.",
              "location": {
                "path": ".github/workflows/deploy.yml",
                "line": 11,
                "column": 24
              },
              "field": "workflow.env.STAGING_DEBUG_TOKEN",
              "source": "github-actions",
              "confidence": "confirmed"
            }
          ],
          "affected_node_ids": [
            "node:workflow:cd5cb50506fd1bf7b5cec52973c96046a046a073d7df9b014c74233e31b0c5ed"
          ],
          "path_ids": [
            "path:6df307be3dc0a63bc1861148b6c6fe99d3407510ce2574c1be9695a175985863"
          ],
          "remediation_id": "REM007"
        },
        {
          "rule_id": "CRD203",
          "title": "Secret passed to shell",
          "category": "github_actions",
          "severity": "high",
          "confidence": "confirmed",
          "evidence": [
            {
              "rule_id": "",
              "type": "shell_credential_reference",
              "description": "Reference is used by this workflow step.",
              "location": {
                "path": ".github/workflows/deploy.yml",
                "line": 20,
                "column": 14
              },
              "field": "jobs.deploy.steps[0]",
              "source": "github-actions",
              "confidence": "confirmed"
            }
          ],
          "affected_node_ids": [
            "node:step:7ef3e6b0b9be2dfd112247537c1e827ad2240163047eade29184797d26a787cc"
          ],
          "path_ids": [
            "path:1fc2b9aa99f4e61dc62756e63b41ed3f7dfeb564975ad57e3e085d879cd2e87b"
          ],
          "remediation_id": "REM008"
        }
      ],
      "contributions": [
        {
          "rule_id": "CRD101",
          "description": "Credential finding imported",
          "base_weight": 15,
          "adjustments": [],
          "adjusted_weight": 15,
          "confidence_weight_percent": 100,
          "final_contribution": 15,
          "confidence": "confirmed",
          "condition_status": "confirmed",
          "risk_or_confidence": "risk",
          "profile_changed": false,
          "evidence": [
            {
              "rule_id": "generic-api-key",
              "type": "scanner_finding",
              "description": "Active production credential, not covered by any allowlist entry",
              "location": {
                "path": ".env.example",
                "line": 2
              },
              "field": "finding",
              "source": "gitleaks",
              "confidence": "confirmed"
            }
          ]
        },
        {
          "rule_id": "CRD102",
          "description": "Credential referenced by workflow",
          "base_weight": 8,
          "adjustments": [],
          "adjusted_weight": 8,
          "confidence_weight_percent": 100,
          "final_contribution": 8,
          "confidence": "confirmed",
          "condition_status": "confirmed",
          "risk_or_confidence": "risk",
          "profile_changed": false,
          "evidence": [
            {
              "rule_id": "",
              "description": "GitHub Actions workflow",
              "location": {
                "path": ".github/workflows/deploy.yml",
                "line": 1,
                "column": 1
              },
              "source": "github-actions",
              "confidence": "confirmed"
            },
            {
              "rule_id": "",
              "type": "signal:secret_copied_to_environment",
              "description": "A secret reference is copied into workflow-level environment scope.",
              "location": {
                "path": ".github/workflows/deploy.yml",
                "line": 11,
                "column": 24
              },
              "field": "workflow.env.STAGING_DEBUG_TOKEN",
              "source": "github-actions",
              "confidence": "confirmed"
            }
          ]
        },
        {
          "rule_id": "CRD203",
          "description": "Secret passed to shell",
          "base_weight": 12,
          "adjustments": [],
          "adjusted_weight": 12,
          "confidence_weight_percent": 100,
          "final_contribution": 12,
          "confidence": "confirmed",
          "condition_status": "confirmed",
          "risk_or_confidence": "risk",
          "profile_changed": false,
          "evidence": [
            {
              "rule_id": "",
              "type": "shell_credential_reference",
              "description": "Reference is used by this workflow step.",
              "location": {
                "path": ".github/workflows/deploy.yml",
                "line": 20,
                "column": 14
              },
              "field": "jobs.deploy.steps[0]",
              "source": "github-actions",
              "confidence": "confirmed"
            }
          ]
        }
      ],
      "confidence": {
        "confirmed": 3,
        "high": 0,
        "medium": 0,
        "low": 0,
        "unknown": 0,
        "overall": "confirmed"
      },
      "reachable": {
        "workflows": 1,
        "jobs": 1,
        "services": 0,
        "permissions": 1,
        "environments": 0,
        "external_actions": 0,
        "published_ports": 0,
        "volume_mounts": 0
      },
      "evidence_paths": [
        {
          "id": "path:1156c5593c85285f8967c7e7baea2caab475b2f506babf1b529a3b2876497844",
          "credential_id": "node:credential:820c73ebb5d7e74de6f10340eed8a410e9e7783fb94a542129faa53cf1ebbb09",
          "nodes": [
            {
              "id": "node:credential:820c73ebb5d7e74de6f10340eed8a410e9e7783fb94a542129faa53cf1ebbb09",
              "type": "credential",
              "label": "ACTIVE_PROD_TOKEN",
              "confidence": "confirmed"
            },